[
  {
    "caseId": "H01",
    "datasetVersion": "1.0.0",
    "mappingVersion": "1.0.0",
    "sourceVersions": {
      "sales": "sales-v1",
      "inventory": "inventory-v1",
      "supplier": "supplier-v1"
    },
    "evidenceKind": "fixture-derived",
    "expectedSourceFacts": {
      "productId": 1011,
      "startInclusive": "2026-10-10T00:00:00Z",
      "endExclusive": "2026-10-20T00:00:00Z",
      "eligibleStatus": "FULFILLED",
      "totals": [
        {
          "currencyCode": "EUR",
          "revenue": "0.00",
          "lineCount": 0,
          "quantity": 0,
          "unit": "BOX"
        }
      ]
    },
    "expectedCalculations": [
      {
        "rule": "sum(quantity * unit_price - line_total_discount), integer minor units; FULFILLED only",
        "currencyCode": "EUR",
        "result": "0.00",
        "lineIds": []
      }
    ],
    "expectedIdentifiers": {
      "mappingIds": []
    },
    "expectedProvenance": [
      {
        "source": "sales",
        "entity": "order_lines",
        "identifiers": []
      },
      {
        "source": "sales",
        "entity": "orders",
        "identifiers": []
      },
      {
        "source": "sales",
        "entity": "products",
        "identifiers": []
      }
    ],
    "expectedStatus": "COMPLETE",
    "completeness": "complete",
    "permissions": {
      "sales": "sales_reader"
    },
    "fault": null,
    "unresolvedExplanation": []
  },
  {
    "caseId": "H02",
    "datasetVersion": "1.0.0",
    "mappingVersion": "1.0.0",
    "sourceVersions": {
      "sales": "sales-v1",
      "inventory": "inventory-v1",
      "supplier": "supplier-v1"
    },
    "evidenceKind": "fixture-derived",
    "expectedSourceFacts": {
      "item": {
        "sku": "WH-729",
        "product_label": "A4 Paper Box",
        "category": "Electronics",
        "unit_code": "BOX",
        "supplier_catalog_ref": "CAT-0940",
        "active": true
      },
      "warehouseScope": "all snapshot warehouses, including maintenance",
      "stock": [
        {
          "stock_id": 3031,
          "sku": "WH-729",
          "warehouse_id": "N1",
          "quantity_on_hand": 100,
          "quantity_reserved": 3,
          "reorder_threshold": 20,
          "last_updated_at": "2026-10-15T12:00:00Z",
          "available_quantity": 97,
          "low_stock": false,
          "warehouse_status": "OPEN"
        },
        {
          "stock_id": 3032,
          "sku": "WH-729",
          "warehouse_id": "S2",
          "quantity_on_hand": 131,
          "quantity_reserved": 6,
          "reorder_threshold": 25,
          "last_updated_at": "2026-10-15T12:00:00Z",
          "available_quantity": 125,
          "low_stock": false,
          "warehouse_status": "OPEN"
        },
        {
          "stock_id": 3033,
          "sku": "WH-729",
          "warehouse_id": "W3",
          "quantity_on_hand": 2,
          "quantity_reserved": 2,
          "reorder_threshold": 10,
          "last_updated_at": "2026-10-15T12:00:00Z",
          "available_quantity": 0,
          "low_stock": true,
          "warehouse_status": "MAINTENANCE"
        }
      ],
      "totalAvailable": 222,
      "unit": "BOX"
    },
    "expectedCalculations": [
      {
        "rule": "available = on_hand - reserved; low iff available <= per-warehouse threshold",
        "availableByStockId": {
          "3031": 97,
          "3032": 125,
          "3033": 0
        }
      }
    ],
    "expectedIdentifiers": {
      "mappingIds": []
    },
    "expectedProvenance": [
      {
        "source": "inventory",
        "entity": "items",
        "identifiers": [
          "WH-729"
        ]
      },
      {
        "source": "inventory",
        "entity": "stock_levels",
        "identifiers": [
          "3031",
          "3032",
          "3033"
        ]
      },
      {
        "source": "inventory",
        "entity": "warehouses",
        "identifiers": [
          "N1",
          "S2",
          "W3"
        ]
      }
    ],
    "expectedStatus": "COMPLETE",
    "completeness": "complete",
    "permissions": {
      "inventory": "inventory_reader"
    },
    "fault": null,
    "unresolvedExplanation": []
  },
  {
    "caseId": "H03",
    "datasetVersion": "1.0.0",
    "mappingVersion": "1.0.0",
    "sourceVersions": {
      "sales": "sales-v1",
      "inventory": "inventory-v1",
      "supplier": "supplier-v1"
    },
    "evidenceKind": "fixture-derived",
    "expectedSourceFacts": {
      "catalogReference": "CAT-0810",
      "asOf": "2026-10-01T00:00:00Z",
      "offers": [
        {
          "offer_id": "OF-0001",
          "catalog_reference": "CAT-0810",
          "supplier_id": "SUP-001",
          "supplier_sku": "VND-4000",
          "unit_cost": "118.29",
          "currency_code": "USD",
          "unit_code": "EA",
          "minimum_order_quantity": 1,
          "available_quantity": 0,
          "lead_time_days": 2,
          "valid_from": "2026-10-01T00:00:00Z",
          "valid_until": "2026-11-01T00:00:00Z"
        }
      ],
      "scope": "Validity only; availability and supplier activity are not silently filtered."
    },
    "expectedCalculations": [],
    "expectedIdentifiers": {
      "mappingIds": []
    },
    "expectedProvenance": [
      {
        "source": "supplier",
        "entity": "offers",
        "identifiers": [
          "OF-0001"
        ]
      }
    ],
    "expectedStatus": "COMPLETE",
    "completeness": "complete",
    "permissions": {
      "supplier": "bearer-read"
    },
    "fault": null,
    "unresolvedExplanation": []
  },
  {
    "caseId": "H04",
    "datasetVersion": "1.0.0",
    "mappingVersion": "1.0.0",
    "sourceVersions": {
      "sales": "sales-v1",
      "inventory": "inventory-v1",
      "supplier": "supplier-v1"
    },
    "evidenceKind": "fixture-derived",
    "expectedSourceFacts": {
      "sales": {
        "productId": 1022,
        "startInclusive": "2026-10-01T00:00:00Z",
        "endExclusive": "2026-11-01T00:00:00Z",
        "eligibleStatus": "FULFILLED",
        "totals": [
          {
            "currencyCode": "EUR",
            "revenue": "384.96",
            "lineCount": 4,
            "quantity": 16,
            "unit": "EA"
          },
          {
            "currencyCode": "GBP",
            "revenue": "264.66",
            "lineCount": 3,
            "quantity": 11,
            "unit": "EA"
          },
          {
            "currencyCode": "USD",
            "revenue": "216.54",
            "lineCount": 3,
            "quantity": 9,
            "unit": "EA"
          }
        ]
      },
      "identity": {
        "productId": 1022,
        "targetSku": "WH-728",
        "mappingIds": [
          "m-sales-1022"
        ],
        "candidates": [
          "WH-728"
        ],
        "approvalStatuses": [
          "APPROVED"
        ]
      },
      "inventory": {
        "item": {
          "sku": "WH-728",
          "product_label": "Switch 8-Port",
          "category": "Office",
          "unit_code": "EA",
          "supplier_catalog_ref": "CAT-1083",
          "active": true
        },
        "warehouseScope": "all snapshot warehouses, including maintenance",
        "stock": [
          {
            "stock_id": 3064,
            "sku": "WH-728",
            "warehouse_id": "N1",
            "quantity_on_hand": 149,
            "quantity_reserved": 9,
            "reorder_threshold": 15,
            "last_updated_at": "2026-10-15T12:00:00Z",
            "available_quantity": 140,
            "low_stock": false,
            "warehouse_status": "OPEN"
          },
          {
            "stock_id": 3065,
            "sku": "WH-728",
            "warehouse_id": "S2",
            "quantity_on_hand": 20,
            "quantity_reserved": 12,
            "reorder_threshold": 20,
            "last_updated_at": "2026-10-15T12:00:00Z",
            "available_quantity": 8,
            "low_stock": true,
            "warehouse_status": "OPEN"
          },
          {
            "stock_id": 3066,
            "sku": "WH-728",
            "warehouse_id": "W3",
            "quantity_on_hand": 51,
            "quantity_reserved": 15,
            "reorder_threshold": 25,
            "last_updated_at": "2026-10-15T12:00:00Z",
            "available_quantity": 36,
            "low_stock": false,
            "warehouse_status": "MAINTENANCE"
          }
        ],
        "totalAvailable": 184,
        "unit": "EA"
      }
    },
    "expectedCalculations": [
      {
        "rule": "sum(quantity * unit_price - line_total_discount), integer minor units; FULFILLED only",
        "currencyCode": "EUR",
        "result": "384.96",
        "lineIds": [
          9110,
          9238,
          9288,
          9416
        ]
      },
      {
        "rule": "sum(quantity * unit_price - line_total_discount), integer minor units; FULFILLED only",
        "currencyCode": "GBP",
        "result": "264.66",
        "lineIds": [
          9084,
          9340,
          9390
        ]
      },
      {
        "rule": "sum(quantity * unit_price - line_total_discount), integer minor units; FULFILLED only",
        "currencyCode": "USD",
        "result": "216.54",
        "lineIds": [
          9008,
          9186,
          9314
        ]
      },
      {
        "rule": "available = on_hand - reserved; low iff available <= per-warehouse threshold",
        "availableByStockId": {
          "3064": 140,
          "3065": 8,
          "3066": 36
        }
      }
    ],
    "expectedIdentifiers": {
      "mappingIds": [
        "m-sales-1022"
      ]
    },
    "expectedProvenance": [
      {
        "source": "inventory",
        "entity": "items",
        "identifiers": [
          "WH-728"
        ]
      },
      {
        "source": "inventory",
        "entity": "stock_levels",
        "identifiers": [
          "3064",
          "3065",
          "3066"
        ]
      },
      {
        "source": "inventory",